{
    "fulltitle": "GB/T 35273—2020《信息安全技术 个人信息安全规范》",
    "table_of_contents": {
        "page": [
            3,
            4
        ],
        "items": [
            {
                "title": "前言",
                "children": []
            },
            {
                "title": "引言",
                "children": []
            },
            {
                "title": "1 范围",
                "children": []
            },
            {
                "title": "2 规范性引用文件",
                "children": []
            },
            {
                "title": "3 术语和定义",
                "children": []
            },
            {
                "title": "4 个人信息安全基本原则",
                "children": []
            },
            {
                "title": "5 个人信息的收集",
                "children": [
                    {
                        "title": "5.1 收集个人信息的合法性",
                        "children": []
                    },
                    {
                        "title": "5.2 收集个人信息的最小必要",
                        "children": []
                    },
                    {
                        "title": "5.3 多项业务功能的自主选择",
                        "children": []
                    },
                    {
                        "title": "5.4 收集个人信息时的授权同意",
                        "children": []
                    },
                    {
                        "title": "5.5 个人信息保护政策",
                        "children": []
                    },
                    {
                        "title": "5.6 征得授权同意的例外",
                        "children": []
                    }
                ]
            },
            {
                "title": "6 个人信息的存储",
                "children": [
                    {
                        "title": "6.1 个人信息存储时间最小化",
                        "children": []
                    },
                    {
                        "title": "6.2 去标识化处理",
                        "children": []
                    },
                    {
                        "title": "6.3 个人敏感信息的传输和存储",
                        "children": []
                    },
                    {
                        "title": "6.4 个人信息控制者停止运营",
                        "children": []
                    }
                ]
            },
            {
                "title": "7 个人信息的使用",
                "children": [
                    {
                        "title": "7.1 个人信息访问控制措施",
                        "children": []
                    },
                    {
                        "title": "7.2 个人信息的展示限制",
                        "children": []
                    },
                    {
                        "title": "7.3 个人信息使用的目的限制",
                        "children": []
                    },
                    {
                        "title": "7.4 用户画像的使用限制",
                        "children": []
                    },
                    {
                        "title": "7.5 个性化展示的使用",
                        "children": []
                    },
                    {
                        "title": "7.6 基于不同业务目的所收集的个人信息的汇聚融合",
                        "children": []
                    },
                    {
                        "title": "7.7 信息系统自动决策机制的使用",
                        "children": []
                    }
                ]
            },
            {
                "title": "8 个人信息主体的权利",
                "children": [
                    {
                        "title": "8.1 个人信息查询",
                        "children": []
                    },
                    {
                        "title": "8.2 个人信息更正",
                        "children": []
                    },
                    {
                        "title": "8.3 个人信息删除",
                        "children": []
                    },
                    {
                        "title": "8.4 个人信息主体撤回授权同意",
                        "children": []
                    },
                    {
                        "title": "8.5 个人信息主体注销账户",
                        "children": []
                    },
                    {
                        "title": "8.6 个人信息主体获取个人信息副本",
                        "children": []
                    },
                    {
                        "title": "8.7 响应个人信息主体的请求",
                        "children": []
                    },
                    {
                        "title": "8.8 投诉管理",
                        "children": []
                    }
                ]
            },
            {
                "title": "9 个人信息的委托处理、共享、转让、公开披露",
                "children": [
                    {
                        "title": "9.1 委托处理",
                        "children": []
                    },
                    {
                        "title": "9.2 个人信息共享、转让",
                        "children": []
                    },
                    {
                        "title": "9.3 收购、兼并、重组、破产时的个人信息转让",
                        "children": []
                    },
                    {
                        "title": "9.4 个人信息公开披露",
                        "children": []
                    },
                    {
                        "title": "9.5 共享、转让、公开披露个人信息时事先征得授权同意的例外",
                        "children": []
                    },
                    {
                        "title": "9.6 共同个人信息控制者",
                        "children": []
                    },
                    {
                        "title": "9.7 第三方接入管理",
                        "children": []
                    },
                    {
                        "title": "9.8 个人信息跨境传输",
                        "children": []
                    }
                ]
            },
            {
                "title": "10 个人信息安全事件处置",
                "children": [
                    {
                        "title": "10.1 个人信息安全事件应急处置和报告",
                        "children": []
                    },
                    {
                        "title": "10.2 安全事件告知",
                        "children": []
                    }
                ]
            },
            {
                "title": "11 组织的个人信息安全管理要求",
                "children": [
                    {
                        "title": "11.1 明确责任部门与人员",
                        "children": []
                    },
                    {
                        "title": "11.2 个人信息安全工程",
                        "children": []
                    },
                    {
                        "title": "11.3 个人信息处理活动记录",
                        "children": []
                    },
                    {
                        "title": "11.4 开展个人信息安全影响评估",
                        "children": []
                    },
                    {
                        "title": "11.5 数据安全能力",
                        "children": []
                    },
                    {
                        "title": "11.6 人员管理与培训",
                        "children": []
                    },
                    {
                        "title": "11.7 安全审计",
                        "children": []
                    }
                ]
            },
            {
                "title": "附录A（资料性附录）个人信息示例",
                "children": []
            },
            {
                "title": "附录B（资料性附录）个人敏感信息判定",
                "children": []
            },
            {
                "title": "附录C（资料性附录）实现个人信息主体自主意愿的方法",
                "children": []
            },
            {
                "title": "附录D（资料性附录）个人信息保护政策模板",
                "children": []
            },
            {
                "title": "参考文献",
                "children": []
            }
        ]
    },
    "blank_pages":[2],
    "sections": [
        {
            "title": "1 范围",
            "pages": [
                7
            ],
            "text": "本标准规定了开展收集、存储、使用、共享、转让、公开披露、删除等个人信息处理活动应遵循的原则和安全要求。本标准适用于规范各类组织的个人信息处理活动，也适用于主管监管部门、第三方评估机构等组织对个人信息处理活动进行监督、管理和评估。",
            "children": []
        },
        {
            "title": "2 规范性引用文件",
            "pages": [
                7
            ],
            "text": "下列文件对于本文件的应用是必不可少的。凡是注日期的引用文件，仅注日期的版本适用于本文件。凡是不注日期的引用文件，其最新版本（包括所有的修改单）适用于本文件。GB/T 25069—2010 信息安全技术 术语",
            "children": []
        },
        {
            "title": "3 术语和定义",
            "pages": [
                7
            ],
            "text": "GB/T 25069—2010界定的以及下列术语和定义适用于本文件。",
            "children": [
                {
                    "title": "3.1",
                    "pages": [
                        7
                    ],
                    "text": "个人信息 personal information\n以电子或者其他方式记录的能够单独或者与其他信息结合识别特定自然人身份或者反映特定自然人活动情况的各种信息。\n注1：个人信息包括姓名、出生日期、身份证件号码、个人生物识别信息、住址、通信通讯联系方式、通信记录和内容、账号密码、财产信息、征信信息、行踪轨迹、住宿信息、健康生理信息、交易信息等。\n注2：关于个人信息的判定方法和类型参见附录A。\n注3：个人信息控制者通过个人信息或其他信息加工处理后形成的信息，例如，用户画像或特征标签，能够单独或者与其他信息结合识别特定自然人身份或者反映特定自然人活动情况的，属于个人信息。"
                },
                {
                    "title": "3.2",
                    "pages": [
                        7,
                        8
                    ],
                    "text": "个人敏感信息 personal sensitive information\n一旦泄露、非法提供或滥用可能危害人身和财产安全，极易导致个人名誉、身心健康受到损害或歧视性待遇等的，属于个人敏感信息。\n注1：个人敏感信息包括身份证件号码、个人生物识别信息、银行账户、通信记录和内容、财产信息、征信信息、行踪轨迹、住宿信息、健康生理信息、交易信息、14 岁以下（含）儿童的个人信息等。\n注2：关于个人敏感信息的判定方法和类型参见附录B。\n注3：个人信息控制者通过个人信息或其他信息加工处理后形成的信息，如一旦泄露、非法提供或滥用可能危害人身和财产安全，极易导致个人名誉、身心健康受到损害或歧视性待遇等的，属于个人敏感信息。"
                },
                {
                    "title": "3.3",
                    "pages": [
                        8
                    ],
                    "text": "个人信息主体 personal information subject\n个人信息所标识或者关联的自然人。"
                },
                {
                    "title": "3.4",
                    "pages": [
                        8
                    ],
                    "text": "个人信息控制者 personal information controller\n有能力决定个人信息处理目的、方式等的组织或个人。"